{
  "$schema": "https://schemas.clark.pro/v1/mcp-conformance-plan.schema.json",
  "schemaVersion": 1,
  "planId": "clark.mcp.conformance",
  "revision": "1.0.0",
  "protocolRevision": "2025-11-25",
  "sdkBaseline": {"package": "@modelcontextprotocol/sdk", "version": "1.29.0", "policy": "pinned-v1-production-baseline"},
  "owners": [
    {"area": "connect", "primaryRole": "W6 Connect Lead", "backupRole": "Developer Platform Lead", "artifactDuty": "Own hostile-server fixtures, adapter quarantine, and compatibility evidence."},
    {"area": "bridge", "primaryRole": "W6 Bridge Lead", "backupRole": "Domain Lead", "artifactDuty": "Own hostile-client fixtures, canonical command reuse, session and scope evidence."},
    {"area": "security", "primaryRole": "Security Lead", "backupRole": "Privacy Lead", "artifactDuty": "Own canaries, origin/auth abuse, severity, incident escalation, and redaction review."},
    {"area": "quality", "primaryRole": "Quality Lead", "backupRole": "Release Lead", "artifactDuty": "Own deterministic execution, artifact retention, regression policy, and release blocking."},
    {"area": "incident", "primaryRole": "Security Lead", "backupRole": "Release Lead", "artifactDuty": "Coordinate credential rotation, quarantine, reconciliation, disclosure, and retest after a critical failure."}
  ],
  "blockingPolicy": {
    "critical": "block_release_and_quarantine",
    "high": "block_capability_promotion",
    "medium": "block_when_protocol_must",
    "secretCanary": "block_release_rotate_canary_review_logs",
    "duplicateEffect": "block_release_reconcile_and_incident_review",
    "quarantineTriggers": ["protocol_corruption", "schema_abuse", "secret_canary", "scope_violation", "unbounded_resource", "untrusted_instruction", "replay_side_effect", "origin_failure", "auth_failure"]
  },
  "cases": [
    {"id":"HOST-BASELINE-01","surface":"connect_host","transport":"stdio","category":"baseline","threatIds":["MCP-S01"],"severity":"medium","ownerArea":"connect","automation":"executable","fixture":"sdk-smoke.mjs","expectedDisposition":"allow","releaseBlocker":false,"acceptance":"Pinned official SDK completes initialize, tools/list, tools/call, and shutdown.","evidencePath":"mcp-conformance/evidence/latest-report.json"},
    {"id":"HOST-FRAMING-01","surface":"connect_host","transport":"stdio","category":"framing","threatIds":["MCP-S01"],"severity":"critical","ownerArea":"connect","automation":"executable","fixture":"stdio-server.mjs#stdout-pollution","expectedDisposition":"quarantine","releaseBlocker":true,"acceptance":"Any non-JSON-RPC stdout line quarantines the server before capability promotion.","evidencePath":"mcp-conformance/evidence/latest-report.json"},
    {"id":"HOST-FRAMING-02","surface":"connect_host","transport":"stdio","category":"framing","threatIds":["MCP-S01"],"severity":"high","ownerArea":"connect","automation":"executable","fixture":"stdio-server.mjs#wrong-id","expectedDisposition":"quarantine","releaseBlocker":true,"acceptance":"A response ID that does not match the pending request is rejected.","evidencePath":"mcp-conformance/evidence/latest-report.json"},
    {"id":"HOST-LIFECYCLE-01","surface":"connect_host","transport":"stdio","category":"lifecycle","threatIds":["MCP-S01"],"severity":"high","ownerArea":"connect","automation":"executable","fixture":"stdio-server.mjs#protocol-downgrade","expectedDisposition":"reject","releaseBlocker":true,"acceptance":"Clark disconnects when the server selects an unsupported protocol revision.","evidencePath":"mcp-conformance/evidence/latest-report.json"},
    {"id":"HOST-LIFECYCLE-02","surface":"connect_host","transport":"stdio","category":"lifecycle","threatIds":["MCP-S01"],"severity":"high","ownerArea":"connect","automation":"executable","fixture":"stdio-server.mjs#capability-overclaim","expectedDisposition":"quarantine","releaseBlocker":true,"acceptance":"A server cannot use a feature it did not negotiate.","evidencePath":"mcp-conformance/evidence/latest-report.json"},
    {"id":"HOST-SCHEMA-01","surface":"connect_host","transport":"stdio","category":"schema","threatIds":["MCP-S01"],"severity":"critical","ownerArea":"quality","automation":"executable","fixture":"stdio-server.mjs#malformed-schema","expectedDisposition":"quarantine","releaseBlocker":true,"acceptance":"Malformed tool input schema is rejected before registration.","evidencePath":"mcp-conformance/evidence/latest-report.json"},
    {"id":"HOST-SCHEMA-02","surface":"connect_host","transport":"stdio","category":"schema","threatIds":["MCP-S01"],"severity":"high","ownerArea":"quality","automation":"executable","fixture":"stdio-server.mjs#schema-depth-bomb","expectedDisposition":"quarantine","releaseBlocker":true,"acceptance":"Schema depth, node count, regex size, and recursive reference budgets are enforced.","evidencePath":"mcp-conformance/evidence/latest-report.json"},
    {"id":"HOST-METADATA-01","surface":"connect_host","transport":"stdio","category":"metadata","threatIds":["MCP-S01","AI-01"],"severity":"critical","ownerArea":"security","automation":"executable","fixture":"stdio-server.mjs#instruction-injection","expectedDisposition":"quarantine","releaseBlocker":true,"acceptance":"Server instructions remain untrusted display data and cannot alter policy or model authority.","evidencePath":"mcp-conformance/evidence/latest-report.json"},
    {"id":"HOST-METADATA-02","surface":"connect_host","transport":"stdio","category":"metadata","threatIds":["MCP-S01","AI-01"],"severity":"critical","ownerArea":"security","automation":"executable","fixture":"stdio-server.mjs#tool-description-injection","expectedDisposition":"quarantine","releaseBlocker":true,"acceptance":"Tool descriptions cannot request secret upload or bypass approval.","evidencePath":"mcp-conformance/evidence/latest-report.json"},
    {"id":"HOST-RESULT-01","surface":"connect_host","transport":"stdio","category":"result","threatIds":["MCP-S01"],"severity":"high","ownerArea":"connect","automation":"executable","fixture":"stdio-server.mjs#oversized-result","expectedDisposition":"terminate","releaseBlocker":true,"acceptance":"Result bytes are capped before rendering, logging, or model context.","evidencePath":"mcp-conformance/evidence/latest-report.json"},
    {"id":"HOST-EGRESS-01","surface":"connect_host","transport":"stdio","category":"egress","threatIds":["MCP-S01","CRED-01"],"severity":"critical","ownerArea":"security","automation":"executable","fixture":"stdio-server.mjs#secret-result","expectedDisposition":"redact_and_quarantine","releaseBlocker":true,"acceptance":"Credential canary in provider output is redacted and quarantines the connection.","evidencePath":"mcp-conformance/evidence/latest-report.json"},
    {"id":"HOST-TIMEOUT-01","surface":"connect_host","transport":"stdio","category":"timeout","threatIds":["MCP-S01"],"severity":"high","ownerArea":"connect","automation":"executable","fixture":"stdio-server.mjs#hang-initialize","expectedDisposition":"terminate","releaseBlocker":true,"acceptance":"Initialization has a hard deadline and the child is terminated.","evidencePath":"mcp-conformance/evidence/latest-report.json"},
    {"id":"HOST-CANCEL-01","surface":"connect_host","transport":"stdio","category":"cancellation","threatIds":["MCP-S01"],"severity":"high","ownerArea":"connect","automation":"executable","fixture":"stdio-server.mjs#hang-call","expectedDisposition":"cancel","releaseBlocker":true,"acceptance":"Request timeout emits notifications/cancelled and stops waiting within the hard maximum.","evidencePath":"mcp-conformance/evidence/latest-report.json"},
    {"id":"HOST-SHUTDOWN-01","surface":"connect_host","transport":"stdio","category":"shutdown","threatIds":["MCP-S01"],"severity":"high","ownerArea":"connect","automation":"executable","fixture":"stdio-server.mjs#ignore-shutdown","expectedDisposition":"terminate","releaseBlocker":true,"acceptance":"Shutdown escalates stdin close to SIGTERM and then SIGKILL on bounded deadlines.","evidencePath":"mcp-conformance/evidence/latest-report.json"},
    {"id":"HOST-HTTP-01","surface":"connect_host","transport":"streamable_http","category":"framing","threatIds":["MCP-S01"],"severity":"high","ownerArea":"connect","automation":"executable","fixture":"hostile-http-server.mjs#wrong-content-type","expectedDisposition":"quarantine","releaseBlocker":true,"acceptance":"HTTP responses outside negotiated JSON or SSE content types are rejected.","evidencePath":"mcp-conformance/evidence/latest-report.json"},
    {"id":"HOST-HTTP-02","surface":"connect_host","transport":"streamable_http","category":"session","threatIds":["MCP-S01"],"severity":"high","ownerArea":"connect","automation":"executable","fixture":"hostile-http-server.mjs#cross-session-sse-replay","expectedDisposition":"quarantine","releaseBlocker":true,"acceptance":"SSE event IDs and session IDs cannot replay data across streams or clients.","evidencePath":"mcp-conformance/evidence/latest-report.json"},
    {"id":"HOST-HTTP-03","surface":"connect_host","transport":"streamable_http","category":"auth","threatIds":["MCP-S01","OAUTH-01"],"severity":"critical","ownerArea":"security","automation":"executable","fixture":"hostile-http-server.mjs#oauth-resource-confusion","expectedDisposition":"reject","releaseBlocker":true,"acceptance":"Tokens are audience/resource-bound and never forwarded to a different MCP origin.","evidencePath":"mcp-conformance/evidence/latest-report.json"},
    {"id":"HOST-HTTP-04","surface":"connect_host","transport":"streamable_http","category":"cancellation","threatIds":["MCP-S01"],"severity":"high","ownerArea":"connect","automation":"executable","fixture":"hostile-http-server.mjs#disconnect-without-cancel","expectedDisposition":"cancel","releaseBlocker":true,"acceptance":"Disconnect is not treated as cancellation; Clark sends an explicit cancellation notification.","evidencePath":"mcp-conformance/evidence/latest-report.json"},